gene_set_library,Term,Overlap,P-value,Adjusted P-value,Odds Ratio,Combined Score,Genes
GO_Biological_Process_2025,Citrulline Metabolic Process (GO:0000052),1/5,0.0049904406959516,0.0675169359249309,262.8421052631579,1393.123889480945,OTC
GO_Biological_Process_2025,Ornithine Metabolic Process (GO:0006591),1/5,0.0049904406959516,0.0675169359249309,262.8421052631579,1393.123889480945,OTC
GO_Biological_Process_2025,Alpha-Amino Acid Biosynthetic Process (GO:1901607),1/5,0.0049904406959516,0.0675169359249309,262.8421052631579,1393.123889480945,OTC
GO_Biological_Process_2025,Double-Strand Break Repair via Synthesis-Dependent Strand Annealing (GO:0045003),1/5,0.0049904406959516,0.0675169359249309,262.8421052631579,1393.123889480945,RAD51
GO_Biological_Process_2025,Monoacylglycerol Biosynthetic Process (GO:0006640),1/6,0.0059856908667451,0.0675169359249309,210.26315789473685,1076.2074808846232,DGAT2
GO_Biological_Process_2025,Tetrahydrofolate Interconversion (GO:0035999),1/6,0.0059856908667451,0.0675169359249309,210.26315789473685,1076.2074808846232,MTHFD2
GO_Biological_Process_2025,Ammonium Homeostasis (GO:0097272),1/6,0.0059856908667451,0.0675169359249309,210.26315789473685,1076.2074808846232,OTC
GO_Biological_Process_2025,Inner Ear Receptor Cell Differentiation (GO:0060113),1/6,0.0059856908667451,0.0675169359249309,210.26315789473685,1076.2074808846232,USH2A
GO_Biological_Process_2025,Urea Cycle (GO:0000050),1/6,0.0059856908667451,0.0675169359249309,210.26315789473685,1076.2074808846232,OTC
GO_Biological_Process_2025,Hair Cell Differentiation (GO:0035315),1/7,0.0069799958941807,0.0675169359249309,175.21052631578948,869.8689177892479,USH2A
GO_Biological_Process_2025,Urea Metabolic Process (GO:0019627),1/7,0.0069799958941807,0.0675169359249309,175.21052631578948,869.8689177892479,OTC
GO_Biological_Process_2025,Non-Proteinogenic Amino Acid Biosynthetic Process (GO:0170043),1/7,0.0069799958941807,0.0675169359249309,175.21052631578948,869.8689177892479,OTC
GO_Biological_Process_2025,Intracellular Triglyceride Homeostasis (GO:0035356),1/8,0.0079733565142536,0.0675169359249309,150.17293233082708,725.5830081396662,DGAT2
GO_Biological_Process_2025,One-Carbon Metabolic Process (GO:0006730),1/10,0.0099572476243861,0.0675169359249309,116.78947368421052,538.3357753631753,MTHFD2
GO_Biological_Process_2025,Telomere Maintenance via Recombination (GO:0000722),1/10,0.0099572476243861,0.0675169359249309,116.78947368421052,538.3357753631753,RAD51
GO_Biological_Process_2025,Tetrahydrofolate Metabolic Process (GO:0046653),1/10,0.0099572476243861,0.0675169359249309,116.78947368421052,538.3357753631753,MTHFD2
GO_Biological_Process_2025,Protein Localization to Condensed Chromosome (GO:1903083),1/10,0.0099572476243861,0.0675169359249309,116.78947368421052,538.3357753631753,SPDL1
GO_Biological_Process_2025,Protein Localization to Kinetochore (GO:0034501),1/11,0.0109477797028559,0.0675169359249309,105.10526315789474,474.5101770765117,SPDL1
GO_Biological_Process_2025,Fatty Acid Homeostasis (GO:0055089),1/11,0.0109477797028559,0.0675169359249309,105.10526315789474,474.5101770765117,DGAT2
GO_Biological_Process_2025,Folic Acid Metabolic Process (GO:0046655),1/11,0.0109477797028559,0.0675169359249309,105.10526315789474,474.5101770765117,MTHFD2
GO_Biological_Process_2025,Arginine Metabolic Process (GO:0006525),1/11,0.0109477797028559,0.0675169359249309,105.10526315789474,474.5101770765117,OTC
GO_Biological_Process_2025,Regulation of Cell Cycle Checkpoint (GO:1901976),1/11,0.0109477797028559,0.0675169359249309,105.10526315789474,474.5101770765117,RAD51
GO_Biological_Process_2025,Monoacylglycerol Metabolic Process (GO:0046462),1/13,0.0129260209528938,0.0675169359249309,87.57894736842105,380.8381798737429,DGAT2
GO_Biological_Process_2025,Adipose Tissue Development (GO:0060612),1/13,0.0129260209528938,0.0675169359249309,87.57894736842105,380.8381798737429,DGAT2
GO_Biological_Process_2025,Non-Proteinogenic Amino Acid Catabolic Process (GO:0170044),1/13,0.0129260209528938,0.0675169359249309,87.57894736842105,380.8381798737429,OTC
GO_Biological_Process_2025,Acute-Phase Response (GO:0006953),1/14,0.01391373176082,0.0675169359249309,80.83805668016194,345.57291333057793,ITIH4
GO_Biological_Process_2025,Extracellular Transport (GO:0006858),1/14,0.01391373176082,0.0675169359249309,80.83805668016194,345.57291333057793,SPA17
GO_Biological_Process_2025,Folic Acid-Containing Compound Metabolic Process (GO:0006760),1/15,0.0149005037888985,0.0675169359249309,75.06015037593986,315.7300332957057,MTHFD2
GO_Biological_Process_2025,Mitotic Recombination (GO:0006312),1/15,0.0149005037888985,0.0675169359249309,75.06015037593986,315.7300332957057,RAD51
GO_Biological_Process_2025,Cellular Response to Alkaloid (GO:0071312),1/16,0.0158863378646896,0.0675169359249309,70.05263157894737,290.1787210723924,RAD51
GO_Biological_Process_2025,Microtubule-Based Transport (GO:0099111),1/16,0.0158863378646896,0.0675169359249309,70.05263157894737,290.1787210723924,SPA17
GO_Biological_Process_2025,Regulation of DNA Damage Checkpoint (GO:2000001),1/16,0.0158863378646896,0.0675169359249309,70.05263157894737,290.1787210723924,RAD51
GO_Biological_Process_2025,Organophosphate Catabolic Process (GO:0046434),1/17,0.0168712348172723,0.068890932251853,65.67105263157895,268.0787715603985,PON1
GO_Biological_Process_2025,"Protein Localization to Chromosome, Centromeric Region (GO:0071459)",1/18,0.0178551954764704,0.068890932251853,61.80495356037152,248.79341471282052,SPDL1
GO_Biological_Process_2025,Triglyceride Biosynthetic Process (GO:0019432),1/18,0.0178551954764704,0.068890932251853,61.80495356037152,248.79341471282052,DGAT2
GO_Biological_Process_2025,fatty-acyl-CoA Metabolic Process (GO:0035337),1/19,0.0188382206720142,0.068890932251853,58.36842105263158,231.8316321803268,DGAT2
GO_Biological_Process_2025,Cellular Response to Fatty Acid (GO:0071398),1/20,0.019820311238232,0.068890932251853,55.29362880886426,216.80897525048425,DGAT2
GO_Biological_Process_2025,Epithelial Cilium Movement Involved in Extracellular Fluid Movement (GO:0003351),1/21,0.0208014680109953,0.068890932251853,52.526315789473685,203.4203291515269,SPA17
GO_Biological_Process_2025,DNA Replication Initiation (GO:0006270),1/21,0.0208014680109953,0.068890932251853,52.526315789473685,203.4203291515269,MCM10
GO_Biological_Process_2025,Acylglycerol Biosynthetic Process (GO:0046463),1/22,0.0217816918149241,0.068890932251853,50.02255639097744,191.42059056605152,DGAT2
GO_Biological_Process_2025,Alpha-Amino Acid Catabolic Process (GO:1901606),1/22,0.0217816918149241,0.068890932251853,50.02255639097744,191.42059056605152,OTC
GO_Biological_Process_2025,Diacylglycerol Metabolic Process (GO:0046339),1/22,0.0217816918149241,0.068890932251853,50.02255639097744,191.42059056605152,DGAT2
GO_Biological_Process_2025,Positive Regulation of Cholesterol Efflux (GO:0010875),1/22,0.0217816918149241,0.068890932251853,50.02255639097744,191.42059056605152,PON1
GO_Biological_Process_2025,Long-Chain fatty-acyl-CoA Metabolic Process (GO:0035336),1/23,0.0227609834903901,0.0703521307884785,47.74641148325359,180.6107068727385,DGAT2
GO_Biological_Process_2025,Acute Inflammatory Response (GO:0002526),1/24,0.0237393438664972,0.0715208773164895,45.66819221967963,170.827422984315,ITIH4
GO_Biological_Process_2025,Carboxylic Acid Catabolic Process (GO:0046395),1/25,0.0247167737784927,0.0715208773164895,43.76315789473684,161.93563879493826,PON1
GO_Biological_Process_2025,Bile Acid Biosynthetic Process (GO:0006699),1/25,0.0247167737784927,0.0715208773164895,43.76315789473684,161.93563879493826,OSBPL3
GO_Biological_Process_2025,Telomere Maintenance via Telomere Lengthening (GO:0010833),1/28,0.0276434890482457,0.0751902902112284,38.89473684210526,139.56851455439977,RAD51
GO_Biological_Process_2025,Positive Regulation of Cholesterol Transport (GO:0032376),1/28,0.0276434890482457,0.0751902902112284,38.89473684210526,139.56851455439977,PON1
GO_Biological_Process_2025,Regulation of DNA Biosynthetic Process (GO:2000278),1/28,0.0276434890482457,0.0751902902112284,38.89473684210526,139.56851455439977,JADE2
GO_Biological_Process_2025,Establishment of Mitotic Spindle Orientation (GO:0000132),1/31,0.0305618601074184,0.0809143549115866,35.0,122.08008572013848,SPDL1
GO_Biological_Process_2025,Bile Acid Metabolic Process (GO:0008206),1/32,0.0315328000758389,0.0809143549115866,33.869269949066215,117.07681999296598,OSBPL3
GO_Biological_Process_2025,Regulation of Cholesterol Efflux (GO:0010874),1/32,0.0315328000758389,0.0809143549115866,33.869269949066215,117.07681999296598,PON1
GO_Biological_Process_2025,Triglyceride Homeostasis (GO:0070328),1/34,0.0334719094011011,0.0842996236768473,31.8133971291866,108.07165990908112,DGAT2
GO_Biological_Process_2025,Carboxylic Acid Metabolic Process (GO:0019752),1/36,0.0354073301248565,0.0859892303032229,29.99248120300752,100.19997336732251,PON1
GO_Biological_Process_2025,Establishment of Mitotic Spindle Localization (GO:0040001),1/36,0.0354073301248565,0.0859892303032229,29.99248120300752,100.19997336732251,SPDL1
GO_Biological_Process_2025,DNA Metabolic Process (GO:0006259),2/302,0.036103034457263,0.0861405734418907,7.288888888888889,24.20915782537029,RAD51;MCM10
GO_Biological_Process_2025,Interstrand Cross-Link Repair (GO:0036297),1/39,0.0383035595748703,0.0890054998076956,27.62049861495845,90.10393439678076,RAD51
GO_Biological_Process_2025,Establishment of Spindle Orientation (GO:0051294),1/40,0.039267132268101,0.0890054998076956,26.910931174089068,87.12057233834933,SPDL1
GO_Biological_Process_2025,Regulation of DNA Recombination (GO:0000018),1/40,0.039267132268101,0.0890054998076956,26.910931174089068,87.12057233834933,RAD51
GO_Biological_Process_2025,Acylglycerol Metabolic Process (GO:0006639),1/42,0.0411915269172122,0.0916071116196174,25.59563543003851,81.63786025385905,DGAT2
GO_Biological_Process_2025,DNA Recombination (GO:0006310),1/43,0.0421523505298068,0.0916071116196174,24.98496240601504,79.11400474395023,RAD51
GO_Biological_Process_2025,DNA-templated DNA Replication Maintenance of Fidelity (GO:0045005),1/44,0.0431122594296053,0.0916071116196174,24.402692778457773,76.72079424655034,RAD51
GO_Biological_Process_2025,Water-Soluble Vitamin Metabolic Process (GO:0006767),1/44,0.0431122594296053,0.0916071116196174,24.402692778457773,76.72079424655034,MTHFD2
GO_Biological_Process_2025,Positive Regulation of Transcription Elongation by RNA Polymerase II (GO:0032968),1/46,0.0450293363875485,0.0916071116196174,23.31578947368421,72.28923154104575,MED17
GO_Biological_Process_2025,Monoatomic Anion Transport (GO:0006820),1/47,0.0459865060964822,0.0916071116196174,22.80778032036613,70.23444455974413,PACC1
GO_Biological_Process_2025,Cellular Response to Radiation (GO:0071478),1/47,0.0459865060964822,0.0916071116196174,22.80778032036613,70.23444455974413,RAD51
GO_Biological_Process_2025,Replication Fork Processing (GO:0031297),1/48,0.0469427643840033,0.0916071116196174,22.32138857782755,68.27724816722397,RAD51
GO_Biological_Process_2025,Triglyceride Metabolic Process (GO:0006641),1/50,0.0488525499820277,0.0916071116196174,21.40816326530612,64.63014669364038,DGAT2
GO_Biological_Process_2025,Inorganic Anion Transport (GO:0015698),1/51,0.0498060789247286,0.0916071116196174,20.978947368421053,62.92883309083605,PACC1
GO_Biological_Process_2025,Sensory Perception (GO:0007600),1/52,0.0507586997365511,0.0916071116196174,20.56656346749226,61.30218505418602,USH2A
GO_Biological_Process_2025,Cellular Response to Ionizing Radiation (GO:0071479),1/53,0.051710413228189,0.0916071116196174,20.17004048582996,59.74559828701417,RAD51
GO_Biological_Process_2025,Positive Regulation of Transcription Initiation by RNA Polymerase II (GO:0060261),1/54,0.0526612202157059,0.0916071116196174,19.788480635551142,58.25483230121243,MED17
GO_Biological_Process_2025,"Positive Regulation of DNA-templated Transcription, Elongation (GO:0032786)",1/54,0.0526612202157059,0.0916071116196174,19.788480635551142,58.25483230121243,MED17
GO_Biological_Process_2025,Regulation of Metabolic Process (GO:0019222),1/55,0.0536111215176,0.0916071116196174,19.42105263157895,56.82597555721978,LPAR2
GO_Biological_Process_2025,DNA-templated DNA Replication (GO:0006261),1/55,0.0536111215176,0.0916071116196174,19.42105263157895,56.82597555721978,MCM10
GO_Biological_Process_2025,Metaphase Chromosome Alignment (GO:0051310),1/55,0.0536111215176,0.0916071116196174,19.42105263157895,56.82597555721978,SPDL1
GO_Biological_Process_2025,Dicarboxylic Acid Metabolic Process (GO:0043648),1/55,0.0536111215176,0.0916071116196174,19.42105263157895,56.82597555721978,MTHFD2
GO_Biological_Process_2025,Epidermal Cell Differentiation (GO:0009913),1/56,0.0545601179499192,0.0916071116196174,19.066985645933013,55.45541451142644,USH2A
GO_Biological_Process_2025,Cellular Response to Alcohol (GO:0097306),1/56,0.0545601179499192,0.0916071116196174,19.066985645933013,55.45541451142644,RAD51
GO_Biological_Process_2025,Mitotic Metaphase Chromosome Alignment (GO:0007080),1/56,0.0545601179499192,0.0916071116196174,19.066985645933013,55.45541451142644,SPDL1
GO_Biological_Process_2025,Regulation of Transcription Initiation by RNA Polymerase II (GO:0060260),1/59,0.0574016861834188,0.0933553140533184,18.07803992740472,51.661282065881295,MED17
GO_Biological_Process_2025,Positive Regulation of DNA-templated Transcription Initiation (GO:2000144),1/59,0.0574016861834188,0.0933553140533184,18.07803992740472,51.661282065881295,MED17
GO_Biological_Process_2025,Phosphatidylcholine Metabolic Process (GO:0046470),1/60,0.058347071283324,0.0933553140533184,17.770740410347905,50.492824203227855,PON1
GO_Biological_Process_2025,RNA Polymerase II Preinitiation Complex Assembly (GO:0051123),1/60,0.058347071283324,0.0933553140533184,17.770740410347905,50.492824203227855,MED17
GO_Biological_Process_2025,DNA-templated Transcription Initiation (GO:0006352),1/62,0.0602351399190365,0.0934852158397695,17.186367558239862,48.28508895429952,MED17
GO_Biological_Process_2025,protein-DNA Complex Assembly (GO:0065004),1/62,0.0602351399190365,0.0934852158397695,17.186367558239862,48.28508895429952,RAD51
GO_Biological_Process_2025,Cilium Movement (GO:0003341),1/63,0.0611778250716139,0.0934852158397695,16.908319185059423,47.24134484792992,SPA17
GO_Biological_Process_2025,Transcription Preinitiation Complex Assembly (GO:0070897),1/63,0.0611778250716139,0.0934852158397695,16.908319185059423,47.24134484792992,MED17
GO_Biological_Process_2025,Monocarboxylic Acid Biosynthetic Process (GO:0072330),1/64,0.0621196118687717,0.0938696357128105,16.639097744360903,46.23495322747936,OSBPL3
GO_Biological_Process_2025,Glycerophospholipid Metabolic Process (GO:0006650),1/65,0.0630605011079274,0.0942442653920673,16.37828947368421,45.26403459739593,PON1
GO_Biological_Process_2025,DNA Damage Response (GO:0006974),2/421,0.0654544957866113,0.0967588198584689,5.187218244497481,14.142432333186868,RAD51;MCM10
GO_Biological_Process_2025,Amide Biosynthetic Process (GO:0043604),1/70,0.0677515123929905,0.0990774804886743,15.187643020594964,40.88374528633187,OTC
GO_Biological_Process_2025,Response to Ionizing Radiation (GO:0010212),1/71,0.0686870333104677,0.0993769843640809,14.969924812030076,40.09237540517205,RAD51
GO_Biological_Process_2025,Telomere Maintenance (GO:0000723),1/72,0.0696216623496152,0.0996689061005017,14.758339510748703,39.32624503481652,RAD51
GO_Biological_Process_2025,Regulation of DNA Replication (GO:0006275),1/73,0.0705554002871621,0.0999534837401464,14.552631578947368,38.5842224505161,JADE2
GO_Biological_Process_2025,Regulation of Transcription Elongation by RNA Polymerase II (GO:0034243),1/79,0.0761391600452789,0.1048106886760966,13.429149797570853,34.58264664318254,MED17
GO_Biological_Process_2025,Cholesterol Homeostasis (GO:0042632),1/80,0.077066682850071,0.1048106886760966,13.258494337108594,33.982637627801715,DGAT2
GO_Biological_Process_2025,Regulation of Double-Strand Break Repair via Homologous Recombination (GO:0010569),1/80,0.077066682850071,0.1048106886760966,13.258494337108594,33.982637627801715,RAD51
GO_Biological_Process_2025,Negative Regulation of Cellular Component Organization (GO:0051129),1/80,0.077066682850071,0.1048106886760966,13.258494337108594,33.982637627801715,PON1
GO_Biological_Process_2025,Sterol Homeostasis (GO:0055092),1/81,0.0779933209779836,0.1050207094357007,13.092105263157896,33.39968978978988,DGAT2
GO_Biological_Process_2025,Organophosphate Metabolic Process (GO:0019637),1/83,0.0798439464103719,0.1064585952138293,12.771501925545572,32.28228555834262,PON1
GO_Biological_Process_2025,Chloride Transport (GO:0006821),1/90,0.0862933855050247,0.1139407808610035,11.762862211709049,28.81903981668561,PACC1
GO_Biological_Process_2025,Regulation of Double-Strand Break Repair (GO:2000779),1/91,0.0872112207421384,0.1140454425089502,11.63157894736842,28.37433281380585,RAD51
GO_Biological_Process_2025,Sensory Perception of Mechanical Stimulus (GO:0050954),1/92,0.0881281800641533,0.1141469760830939,11.50318102949682,27.94080032839929,USH2A
GO_Biological_Process_2025,Sensory Perception of Sound (GO:0007605),1/96,0.0917872740073591,0.1177648043868004,11.01662049861496,26.310792233027552,USH2A
GO_Biological_Process_2025,Sensory Perception of Light Stimulus (GO:0050953),1/101,0.0963415280618174,0.1213189612630293,10.463157894736842,24.48228086178406,USH2A
GO_Biological_Process_2025,Recombinational Repair (GO:0000725),1/101,0.0963415280618174,0.1213189612630293,10.463157894736842,24.48228086178406,RAD51
GO_Biological_Process_2025,Regulation of Cellular Response to Stress (GO:0080135),1/111,0.1053850316942243,0.1312415459865531,9.507177033492823,21.392428630708658,RAD51
GO_Biological_Process_2025,Regulation of Wnt Signaling Pathway (GO:0030111),1/112,0.1062846380154363,0.1312415459865531,9.421052631578949,21.11855678854484,DEPDC1B
GO_Biological_Process_2025,Positive Regulation of Wnt Signaling Pathway (GO:0030177),1/114,0.1080812731653967,0.1312415459865531,9.253376804843969,20.587577159291502,DEPDC1B
GO_Biological_Process_2025,Double-Strand Break Repair via Homologous Recombination (GO:0000724),1/114,0.1080812731653967,0.1312415459865531,9.253376804843969,20.587577159291502,RAD51
GO_Biological_Process_2025,Regulation of DNA Metabolic Process (GO:0051052),1/116,0.1098744767967273,0.1322383083571231,9.091533180778033,20.077893566776314,JADE2
GO_Biological_Process_2025,Mitotic Sister Chromatid Segregation (GO:0000070),1/120,0.1134506143347115,0.1353445925396558,8.784166298098187,19.117751070838278,SPDL1
GO_Biological_Process_2025,Transcription Initiation at RNA Polymerase II Promoter (GO:0006367),1/123,0.1161237558827442,0.136145093103907,8.566867989646246,18.4453131497958,MED17
GO_Biological_Process_2025,Response to Cytokine (GO:0034097),1/123,0.1161237558827442,0.136145093103907,8.566867989646246,18.4453131497958,ITIH4
GO_Biological_Process_2025,Adenylate Cyclase-Activating G Protein-Coupled Receptor Signaling Pathway (GO:0007189),1/153,0.1424373812642738,0.1655682380507799,6.865650969529086,13.380143154067955,LPAR2
GO_Biological_Process_2025,Regulation of Cellular Component Organization (GO:0051128),1/159,0.1476100199777224,0.1701268026861886,6.602931379080613,12.632606048584067,JADE2
GO_Biological_Process_2025,Regulation of Macromolecule Biosynthetic Process (GO:0010556),1/170,0.1570163016887245,0.1794472019299709,6.169729056368732,11.422671213025856,JADE2
GO_Biological_Process_2025,Double-Strand Break Repair (GO:0006302),1/176,0.1621053521282268,0.1837193990786571,5.9563909774436095,10.837705998274306,RAD51
GO_Biological_Process_2025,Neuron Differentiation (GO:0030182),1/181,0.1663239190403913,0.1869425866900265,5.789473684210527,10.385262524745686,USH2A
GO_Biological_Process_2025,Transcription by RNA Polymerase II (GO:0006366),1/200,0.182171186958547,0.2030760772652655,5.231684739486909,8.908556962758436,MED17
GO_Biological_Process_2025,Adenylate Cyclase-Modulating G Protein-Coupled Receptor Signaling Pathway (GO:0007188),1/202,0.1838225713143234,0.2032509731605528,5.17910447761194,8.772285712048289,LPAR2
GO_Biological_Process_2025,Negative Regulation of Cell Differentiation (GO:0045596),1/220,0.1985431540949234,0.2177570077170127,4.749098774333093,7.678099751613271,USH2A
GO_Biological_Process_2025,Regulation of Cell Growth (GO:0001558),1/222,0.2001631152011021,0.2177774693387991,4.705644201000238,7.569605933177322,JADE2
GO_Biological_Process_2025,Negative Regulation of Multicellular Organismal Process (GO:0051241),1/243,0.2169859601744004,0.2342070681247497,4.292735972161809,6.558968424426781,PON1
GO_Biological_Process_2025,Positive Regulation of Signal Transduction (GO:0009967),1/256,0.2272310643777576,0.2433340531919294,4.071207430340557,6.032665804717162,DEPDC1B
GO_Biological_Process_2025,DNA Repair (GO:0006281),1/302,0.262469926784462,0.2788742972084909,3.440986186396223,4.602727703848208,RAD51
GO_Biological_Process_2025,Regulation of Cell Cycle (GO:0051726),1/318,0.2743649978381094,0.2892530209766115,3.264652166694338,4.22216142588564,JADE2
GO_Biological_Process_2025,Regulation of RNA Biosynthetic Process (GO:2001141),1/465,0.3754452453109483,0.3927734874022229,2.2137023593466423,2.168637215715515,JADE2
GO_Biological_Process_2025,Positive Regulation of RNA Biosynthetic Process (GO:1902680),1/555,0.4305682662728285,0.4470021695656845,1.845525365760973,1.5551308297796114,MED17
GO_Biological_Process_2025,Positive Regulation of Transcription by RNA Polymerase II (GO:0045944),1/983,0.6352227274264486,0.6544719009848258,1.0182227462750564,0.4620487000643764,MED17
GO_Biological_Process_2025,Regulation of DNA-templated Transcription (GO:0006355),2/2139,0.6466467249068517,0.661232741258134,0.9277283835075132,0.4044479701549366,JADE2;MED17
GO_Biological_Process_2025,Regulation of Transcription by RNA Polymerase II (GO:0006357),2/2250,0.6752161871807997,0.6852940407208117,0.8764333728746541,0.3441949844033072,JADE2;MED17
GO_Biological_Process_2025,Regulation of Gene Expression (GO:0010468),1/1127,0.6866905044097535,0.6917771007387146,0.8812751238665046,0.3312462831890405,JADE2
GO_Biological_Process_2025,Positive Regulation of DNA-templated Transcription (GO:0045893),1/1274,0.7320701473766096,0.7320701473766096,0.7734320089304172,0.2412171550011246,MED17
